{
 "schema_version": "0.1",
 "id": "anandaloke-mangalaloke",
 "title": {
  "bn": "আনন্দলোকে মঙ্গলালোকে",
  "translit": "Anandaloke mangalaloke"
 },
 "composer": "Rabindranath Tagore",
 "parjaay": {
  "bn": "পূজা",
  "en": "Worship (Brahmasangeet)"
 },
 "raga_anga": null,
 "taal": {
  "name": {
   "bn": "একতাল",
   "translit": "ektaal"
  },
  "matras": 12,
  "vibhags": [
   3,
   3,
   3,
   3
  ],
  "beats": [
   "sam",
   "taali",
   "khali",
   "taali"
  ],
  "talamukta": false
 },
 "sections": [
  "sthayi",
  "antara",
  "sanchari",
  "abhog",
  "body5",
  "body6",
  "body7"
 ],
 "lines": [
  {
   "line_no": 1,
   "section": "sthayi",
   "cells": [
    {
     "units": [
      {
       "type": "swara",
       "swara": {
        "degree": "G",
        "saptak": 0
       }
      }
     ],
     "lyric": "আ",
     "melisma": false
    },
    {
     "units": [
      {
       "type": "sustain"
      }
     ],
     "lyric": null,
     "melisma": true
    },
    {
     "units": [
      {
       "type": "sustain"
      }
     ],
     "lyric": null,
     "melisma": true
    },
    {
     "units": [
      {
       "type": "swara",
       "swara": {
        "degree": "G",
        "saptak": 0
       }
      }
     ],
     "lyric": "ন",
     "melisma": false
    },
    {
     "units": [
      {
       "type": "sustain"
      }
     ],
     "lyric": "ন্",
     "melisma": false
    },
    {
     "units": [
      {
       "type": "swara",
       "swara": {
        "degree": "G",
        "saptak": 0
       }
      }
     ],
     "lyric": "দ",
     "melisma": false
    },
    {
     "units": [
      {
       "type": "swara",
       "swara": {
        "degree": "G",
        "saptak": 0
       },
       "kan": [
        {
         "degree": "R",
         "saptak": 0
        }
       ]
      }
     ],
     "lyric": "লো",
     "melisma": false
    },
    {
     "units": [
      {
       "type": "sustain"
      }
     ],
     "lyric": null,
     "melisma": true
    },
    {
     "units": [
      {
       "type": "sustain"
      }
     ],
     "lyric": null,
     "melisma": true
    },
    {
     "units": [
      {
       "type": "swara",
       "swara": {
        "degree": "R",
        "saptak": 0
       }
      }
     ],
     "lyric": "কে",
     "melisma": false
    },
    {
     "units": [
      {
       "type": "sustain"
      }
     ],
     "lyric": null,
     "melisma": true
    },
    {
     "units": [
      {
       "type": "sustain"
      }
     ],
     "lyric": null,
     "melisma": true
    }
   ],
   "marks": [
    {
     "type": "section_bar",
     "cell": 0
    },
    {
     "type": "vibhag",
     "cell": 3
    },
    {
     "type": "vibhag",
     "cell": 6
    },
    {
     "type": "vibhag",
     "cell": 9
    },
    {
     "type": "bar",
     "cell": 12
    }
   ]
  },
  {
   "line_no": 2,
   "section": "sthayi",
   "cells": [
    {
     "units": [
      {
       "type": "swara",
       "swara": {
        "degree": "G",
        "saptak": 0
       }
      }
     ],
     "lyric": "ম",
     "melisma": false
    },
    {
     "units": [
      {
       "type": "sustain"
      }
     ],
     "lyric": "ঙ্",
     "melisma": false
    },
    {
     "units": [
      {
       "type": "swara",
       "swara": {
        "degree": "P",
        "saptak": 0
       }
      }
     ],
     "lyric": "গ",
     "melisma": false
    },
    {
     "units": [
      {
       "type": "swara",
       "swara": {
        "degree": "M",
        "saptak": 0
       }
      }
     ],
     "lyric": "লা",
     "melisma": false
    },
    {
     "units": [
      {
       "type": "sustain"
      }
     ],
     "lyric": null,
     "melisma": true
    },
    {
     "units": [
      {
       "type": "sustain"
      }
     ],
     "lyric": null,
     "melisma": true
    },
    {
     "units": [
      {
       "type": "swara",
       "swara": {
        "degree": "M",
        "saptak": 0
       }
      }
     ],
     "lyric": "লো",
     "melisma": false
    },
    {
     "units": [
      {
       "type": "sustain"
      }
     ],
     "lyric": null,
     "melisma": true
    },
    {
     "units": [
      {
       "type": "sustain"
      },
      {
       "type": "swara",
       "swara": {
        "degree": "D",
        "saptak": 0
       }
      }
     ],
     "lyric": null,
     "melisma": true
    },
    {
     "units": [
      {
       "type": "swara",
       "swara": {
        "degree": "P",
        "saptak": 0
       }
      }
     ],
     "lyric": "কে",
     "melisma": false
    },
    {
     "units": [
      {
       "type": "sustain"
      }
     ],
     "lyric": null,
     "melisma": true
    },
    {
     "units": [
      {
       "type": "sustain"
      }
     ],
     "lyric": null,
     "melisma": true
    }
   ],
   "marks": [
    {
     "type": "bar",
     "cell": 0
    },
    {
     "type": "vibhag",
     "cell": 3
    },
    {
     "type": "vibhag",
     "cell": 6
    },
    {
     "type": "vibhag",
     "cell": 9
    },
    {
     "type": "bar",
     "cell": 12
    }
   ]
  },
  {
   "line_no": 3,
   "section": "sthayi",
   "cells": [
    {
     "units": [
      {
       "type": "swara",
       "swara": {
        "degree": "S",
        "saptak": 0
       }
      }
     ],
     "lyric": "বি",
     "melisma": false
    },
    {
     "units": [
      {
       "type": "sustain"
      }
     ],
     "lyric": null,
     "melisma": true
    },
    {
     "units": [
      {
       "type": "sustain"
      }
     ],
     "lyric": null,
     "melisma": true
    },
    {
     "units": [
      {
       "type": "swara",
       "swara": {
        "degree": "R",
        "saptak": 0
       }
      }
     ],
     "lyric": "রা",
     "melisma": false
    },
    {
     "units": [
      {
       "type": "sustain"
      }
     ],
     "lyric": null,
     "melisma": true
    },
    {
     "units": [
      {
       "type": "sustain"
      }
     ],
     "lyric": null,
     "melisma": true
    },
    {
     "units": [
      {
       "type": "swara",
       "swara": {
        "degree": "G",
        "saptak": 0
       },
       "kan": [
        {
         "degree": "R",
         "saptak": 0
        }
       ]
      }
     ],
     "lyric": "জ'",
     "melisma": false
    },
    {
     "units": [
      {
       "type": "sustain"
      }
     ],
     "lyric": null,
     "melisma": true
    },
    {
     "units": [
      {
       "type": "sustain"
      }
     ],
     "lyric": null,
     "melisma": true
    },
    {
     "units": [
      {
       "type": "sustain"
      }
     ],
     "lyric": null,
     "melisma": true
    },
    {
     "units": [
      {
       "type": "sustain"
      }
     ],
     "lyric": null,
     "melisma": true
    },
    {
     "units": [
      {
       "type": "sustain"
      },
      {
       "type": "swara",
       "swara": {
        "degree": "R",
        "saptak": 0
       }
      },
      {
       "type": "swara",
       "swara": {
        "degree": "S",
        "saptak": 0
       }
      }
     ],
     "lyric": null,
     "melisma": true
    }
   ],
   "marks": [
    {
     "type": "bar",
     "cell": 0
    },
    {
     "type": "vibhag",
     "cell": 3
    },
    {
     "type": "vibhag",
     "cell": 6
    },
    {
     "type": "vibhag",
     "cell": 9
    },
    {
     "type": "bar",
     "cell": 12
    }
   ]
  },
  {
   "line_no": 4,
   "section": "sthayi",
   "cells": [
    {
     "units": [
      {
       "type": "swara",
       "swara": {
        "degree": "S",
        "saptak": 0
       }
      }
     ],
     "lyric": "স",
     "melisma": false
    },
    {
     "units": [
      {
       "type": "sustain"
      }
     ],
     "lyric": "ত্",
     "melisma": false
    },
    {
     "units": [
      {
       "type": "swara",
       "swara": {
        "degree": "G",
        "saptak": 0
       }
      }
     ],
     "lyric": "ত",
     "melisma": false
    },
    {
     "units": [
      {
       "type": "swara",
       "swara": {
        "degree": "R",
        "saptak": 0
       }
      }
     ],
     "lyric": "সু",
     "melisma": false
    },
    {
     "units": [
      {
       "type": "sustain"
      }
     ],
     "lyric": "ন্",
     "melisma": false
    },
    {
     "units": [
      {
       "type": "swara",
       "swara": {
        "degree": "N",
        "saptak": -1
       }
      }
     ],
     "lyric": "দ",
     "melisma": false
    },
    {
     "units": [
      {
       "type": "swara",
       "swara": {
        "degree": "S",
        "saptak": 0
       }
      },
      {
       "type": "swara",
       "swara": {
        "degree": "R",
        "saptak": 0
       }
      },
      {
       "type": "swara",
       "swara": {
        "degree": "S",
        "saptak": 0
       }
      }
     ],
     "lyric": "র৹৹",
     "melisma": false
    },
    {
     "units": [
      {
       "type": "sustain"
      }
     ],
     "lyric": null,
     "melisma": true
    },
    {
     "units": [
      {
       "type": "sustain"
      }
     ],
     "lyric": null,
     "melisma": true
    },
    {
     "units": [
      {
       "type": "sustain"
      }
     ],
     "lyric": null,
     "melisma": true
    },
    {
     "units": [
      {
       "type": "sustain"
      }
     ],
     "lyric": null,
     "melisma": true
    },
    {
     "units": [
      {
       "type": "sustain"
      }
     ],
     "lyric": null,
     "melisma": true
    }
   ],
   "marks": [
    {
     "type": "bar",
     "cell": 0
    },
    {
     "type": "vibhag",
     "cell": 3
    },
    {
     "type": "vibhag",
     "cell": 6
    },
    {
     "type": "vibhag",
     "cell": 9
    },
    {
     "type": "section_bar",
     "cell": 12
    }
   ]
  },
  {
   "line_no": 5,
   "section": "antara",
   "cells": [
    {
     "units": [
      {
       "type": "swara",
       "swara": {
        "degree": "S",
        "saptak": 0
       }
      }
     ],
     "lyric": "ম",
     "melisma": false
    },
    {
     "units": [
      {
       "type": "swara",
       "swara": {